{
  "schema_version": 1,
  "status": "partial",
  "project": "radishflow",
  "task": "suggest_flowsheet_edits",
  "summary": "当前建议先为 Heater Outlet 预留下游重连占位，再补 Heater Feed 的关键规格，最后为 Trim Heater 补出口温度目标占位；顺序应按阻塞性和风险等级稳定排列。",
  "answers": [
    {
      "kind": "edit_rationale",
      "text": "这三个问题都落在当前选择集内，但优先级不相同：断链会直接阻塞拓扑闭环，因此应先处理；入口规格不完整会继续限制求解输入，因此排第二；本地参数占位虽然也需要补，但应排在前两者之后。",
      "citation_ids": [
        "diag-1",
        "diag-2",
        "diag-3",
        "flowdoc-stream-1",
        "flowdoc-stream-2",
        "flowdoc-unit-1",
        "snapshot-1"
      ]
    }
  ],
  "issues": [
    {
      "code": "STREAM_DISCONNECTED",
      "message": "product-7 当前没有下游去向，需先由人工确认后续连接目标。",
      "severity": "error",
      "citation_ids": [
        "diag-1",
        "flowdoc-stream-2",
        "snapshot-1"
      ]
    },
    {
      "code": "STREAM_SPEC_MISSING",
      "message": "feed-7 缺少温度和流量规格，当前上游输入状态仍不完整。",
      "severity": "error",
      "citation_ids": [
        "diag-2",
        "flowdoc-stream-1"
      ]
    },
    {
      "code": "UNIT_PARAMETER_INCOMPLETE",
      "message": "heater-3 已启用出口温度控制模式，但缺少 outlet_temperature_c 目标参数。",
      "severity": "error",
      "citation_ids": [
        "diag-3",
        "flowdoc-unit-1"
      ]
    }
  ],
  "proposed_actions": [
    {
      "kind": "candidate_edit",
      "title": "为 product-7 预留下游重连占位",
      "target": {
        "type": "stream",
        "id": "product-7"
      },
      "rationale": "当前断链问题会先阻塞拓扑闭环，因此应优先给出高风险但可审查的连接占位提案。",
      "patch": {
        "connection_placeholder": {
          "expected_downstream_kind": "consumer_or_export_sink",
          "requires_manual_binding": true
        }
      },
      "risk_level": "high",
      "requires_confirmation": true,
      "citation_ids": [
        "diag-1",
        "flowdoc-stream-2",
        "snapshot-1"
      ]
    },
    {
      "kind": "candidate_edit",
      "title": "为 feed-7 补充入口规格占位",
      "target": {
        "type": "stream",
        "id": "feed-7"
      },
      "rationale": "在断链问题之后，最直接影响求解输入完整性的就是 feed-7 缺少关键规格，因此第二步应先补上游规格占位。",
      "patch": {
        "spec_placeholders": [
          "temperature_c",
          "flow_rate_kg_per_h"
        ],
        "retain_existing_specs": true
      },
      "risk_level": "medium",
      "requires_confirmation": true,
      "citation_ids": [
        "diag-2",
        "flowdoc-stream-1"
      ]
    },
    {
      "kind": "candidate_edit",
      "title": "为 heater-3 补充出口温度目标占位",
      "target": {
        "type": "unit",
        "id": "heater-3"
      },
      "rationale": "当前单元参数问题同样需要修复，但优先级应排在断链和上游规格之后，因此最后给出本地参数占位提案。",
      "patch": {
        "parameter_placeholders": [
          "outlet_temperature_c"
        ],
        "patch_scope": "unit_parameters",
        "preserve_existing_connections": true
      },
      "risk_level": "medium",
      "requires_confirmation": true,
      "citation_ids": [
        "diag-3",
        "flowdoc-unit-1"
      ]
    }
  ],
  "citations": [
    {
      "id": "diag-1",
      "kind": "context",
      "label": "诊断 STREAM_DISCONNECTED",
      "locator": "context:diagnostics[0]",
      "excerpt": "Heater Outlet is not connected to any downstream consumer or export sink."
    },
    {
      "id": "diag-2",
      "kind": "context",
      "label": "诊断 STREAM_SPEC_MISSING",
      "locator": "context:diagnostics[1]",
      "excerpt": "Heater Feed is missing temperature and flow rate specifications."
    },
    {
      "id": "diag-3",
      "kind": "context",
      "label": "诊断 UNIT_PARAMETER_INCOMPLETE",
      "locator": "context:diagnostics[2]",
      "excerpt": "Trim Heater is configured for outlet temperature control but outlet temperature target is missing."
    },
    {
      "id": "flowdoc-stream-1",
      "kind": "artifact",
      "label": "FlowsheetDocument / feed-7",
      "locator": "artifact:flowsheet_document.streams[0]",
      "excerpt": "feed-7 当前只有 pressure_kpa，缺少 temperature_c 和 flow_rate_kg_per_h。"
    },
    {
      "id": "flowdoc-stream-2",
      "kind": "artifact",
      "label": "FlowsheetDocument / product-7",
      "locator": "artifact:flowsheet_document.streams[1]",
      "excerpt": "product-7 当前只有 source_unit_id 和 temperature_c，没有下游连接信息。"
    },
    {
      "id": "flowdoc-unit-1",
      "kind": "artifact",
      "label": "FlowsheetDocument / heater-3",
      "locator": "artifact:flowsheet_document.units[0]",
      "excerpt": "heater-3 处于 outlet_temperature 控制模式，但未见目标参数。"
    },
    {
      "id": "snapshot-1",
      "kind": "context",
      "label": "求解快照 latest_snapshot",
      "locator": "context:latest_snapshot",
      "excerpt": "solver_status=invalid_topology"
    }
  ],
  "confidence": 0.9,
  "risk_level": "high",
  "requires_confirmation": true
}
