{
  "schema_version": 1,
  "project": "radishflow",
  "task": "suggest_flowsheet_edits",
  "requires_confirmation": true,
  "answers": [
    {
      "kind": "direct_answer",
      "text": "当前选择集覆盖 heater-6 → cooler-7 → separator-7 三个单元及其关联的四条流股。诊断链表明唯一的根因错误是 feed-44（Recycle Feed）缺少压力规格，其余三条警告均为该缺失向下游传播的衍生效应。本提案仅针对 feed-44 补全压力占位，以消除根因错误并使下游警告具备自行消退的条件。",
      "citation_ids": [
        "diag-1",
        "flowdoc-stream-1",
        "flowdoc-unit-1"
      ]
    }
  ],
  "proposed_actions": [
    {
      "kind": "candidate_edit",
      "title": "为 Recycle Feed (feed-44) 补全压力规格占位",
      "rationale": "feed-44 是当前唯一的 error 级诊断目标（STREAM_SPEC_MISSING）。下游 heated-44 的压力为 208 kPa，考虑到加热器通常存在少量压降，进料压力应略高于 208 kPa。此处以 210 kPa 作为占位建议值，用户应根据实际工艺条件确认或修改。补全该规格后，heater-6、cooler-7、separator-7 的三条衍生警告预期将在重新求解后自行消退。",
      "risk_level": "medium",
      "requires_confirmation": true,
      "citation_ids": [
        "diag-1",
        "flowdoc-stream-1",
        "flowdoc-unit-1"
      ],
      "target": {
        "type": "stream",
        "id": "feed-44"
      },
      "patch": {
        "spec_placeholders": [
          "pressure_kpa"
        ],
        "retain_existing_specs": true
      }
    }
  ],
  "status": "partial",
  "issues": [
    {
      "code": "STREAM_SPEC_MISSING",
      "message": "Recycle Feed is missing pressure specification.",
      "severity": "error",
      "citation_ids": [
        "diag-1",
        "flowdoc-stream-1",
        "flowdoc-unit-1"
      ]
    },
    {
      "code": "SEPARATOR_STATE_DEPENDENT",
      "message": "Recycle Separator behavior still depends on the unresolved upstream feed pressure.",
      "severity": "warning",
      "citation_ids": [
        "diag-2",
        "flowdoc-unit-3",
        "flowdoc-stream-4",
        "snapshot-1"
      ]
    },
    {
      "code": "HEATER_OUTLET_EFFECT_UNCONFIRMED",
      "message": "Feed Trim Heater outlet response may still be influenced by the incomplete feed pressure state.",
      "severity": "warning",
      "citation_ids": [
        "diag-3",
        "flowdoc-unit-1",
        "snapshot-1"
      ]
    },
    {
      "code": "COOLER_OUTLET_EFFECT_UNCONFIRMED",
      "message": "Recycle Cooler outlet response is still downstream of the unresolved feed pressure gap, so the cooler itself is not yet a confirmed root cause.",
      "severity": "warning",
      "citation_ids": [
        "diag-4",
        "flowdoc-unit-2",
        "snapshot-1"
      ]
    }
  ],
  "citations": [
    {
      "id": "diag-1",
      "kind": "context",
      "label": "诊断 STREAM_SPEC_MISSING",
      "locator": "context:diagnostics[0]",
      "excerpt": "Recycle Feed is missing pressure specification."
    },
    {
      "id": "diag-2",
      "kind": "context",
      "label": "诊断 SEPARATOR_STATE_DEPENDENT",
      "locator": "context:diagnostics[1]",
      "excerpt": "Recycle Separator behavior still depends on the unresolved upstream feed pressure."
    },
    {
      "id": "diag-3",
      "kind": "context",
      "label": "诊断 HEATER_OUTLET_EFFECT_UNCONFIRMED",
      "locator": "context:diagnostics[2]",
      "excerpt": "Feed Trim Heater outlet response may still be influenced by the incomplete feed pressure state."
    },
    {
      "id": "diag-4",
      "kind": "context",
      "label": "诊断 COOLER_OUTLET_EFFECT_UNCONFIRMED",
      "locator": "context:diagnostics[3]",
      "excerpt": "Recycle Cooler outlet response is still downstream of the unresolved feed pressure gap, so the cooler itself is not yet a confirmed root cause."
    },
    {
      "id": "flowdoc-stream-1",
      "kind": "artifact",
      "label": "FlowsheetDocument / feed-44",
      "locator": "artifact:flowsheet_document.streams[0]",
      "excerpt": "feed-44 Recycle Feed target_unit_id=heater-6"
    },
    {
      "id": "flowdoc-unit-1",
      "kind": "artifact",
      "label": "FlowsheetDocument / heater-6",
      "locator": "artifact:flowsheet_document.units[0]",
      "excerpt": "heater-6 Feed Trim Heater kind=Heater"
    },
    {
      "id": "flowdoc-unit-3",
      "kind": "artifact",
      "label": "FlowsheetDocument / separator-7",
      "locator": "artifact:flowsheet_document.units[2]",
      "excerpt": "separator-7 Recycle Separator kind=FlashDrum"
    },
    {
      "id": "flowdoc-stream-4",
      "kind": "artifact",
      "label": "FlowsheetDocument / vapor-44",
      "locator": "artifact:flowsheet_document.streams[3]",
      "excerpt": "vapor-44 Recycle Separator Vapor source_unit_id=separator-7"
    },
    {
      "id": "flowdoc-unit-2",
      "kind": "artifact",
      "label": "FlowsheetDocument / cooler-7",
      "locator": "artifact:flowsheet_document.units[1]",
      "excerpt": "cooler-7 Recycle Cooler kind=Cooler"
    },
    {
      "id": "snapshot-1",
      "kind": "context",
      "label": "求解快照 latest_snapshot",
      "locator": "context:latest_snapshot",
      "excerpt": "solver_status=partial_convergence residual_norm=0.13"
    }
  ],
  "summary": "当前选择集覆盖 heater-6 → cooler-7 → separator-7 三个单元及其关联的四条流股。诊断链表明唯一的根因错误是 feed-44（Recycle Feed）缺少压力规格，其余三条警告均为该缺失向下游传播的衍生效应。本提案仅针对 feed-44 补全压力占位，以消除根因错误并使下游警告具备自行消退的条件。",
  "risk_level": "medium",
  "confidence": 0.2
}
