{
  "schema_version": 1,
  "project": "radishflow",
  "task": "suggest_flowsheet_edits",
  "status": "partial",
  "confidence": 0.85,
  "summary": "针对当前选中的多个对象，重点关注有直接诊断错误支撑的进料流（Preheater Feed），建议先补充其缺失的温度规定以消除上游不确定性。",
  "issues": [
    {
      "code": "STREAM_SPEC_MISSING",
      "message": "Preheater Feed is missing temperature specification.",
      "severity": "error",
      "citation_ids": [
        "diag-1",
        "flowdoc-stream-1",
        "flowdoc-unit-1"
      ]
    },
    {
      "code": "HEATER_OUTLET_EFFECT_UNCONFIRMED",
      "message": "The current outlet response may still be influenced by upstream uncertainty, so the heater effect is not yet confirmed as a separate root cause.",
      "severity": "warning",
      "citation_ids": [
        "diag-2",
        "flowdoc-unit-1",
        "snapshot-1"
      ]
    }
  ],
  "answers": [
    {
      "kind": "direct_answer",
      "text": "针对您选中的进料流与换热器单元，我已生成候选编辑提案。根据诊断信息，目前主要问题在于进料流（Preheater Feed）缺失温度规定，这带来了上游不确定性并导致下游换热器结果受到影响。在此阶段，建议仅针对进料流生成温度规范占位符进行局部修复并等待审查。",
      "citation_ids": [
        "diag-1",
        "flowdoc-stream-1",
        "flowdoc-unit-1"
      ]
    }
  ],
  "requires_confirmation": true,
  "proposed_actions": [
    {
      "kind": "candidate_edit",
      "target": {
        "type": "stream",
        "id": "feed-6"
      },
      "title": "为 feed-6 补充缺失规格占位",
      "rationale": "当前诊断已明确指出该流股规格不完整，因此更合适的是补局部规格占位，而不是给整图 patch。",
      "patch": {
        "spec_placeholders": [
          "temperature_c"
        ],
        "retain_existing_specs": true
      },
      "risk_level": "medium",
      "requires_confirmation": true,
      "citation_ids": [
        "diag-1",
        "flowdoc-stream-1",
        "flowdoc-unit-1"
      ]
    }
  ],
  "citations": [
    {
      "id": "diag-1",
      "kind": "context",
      "label": "诊断 STREAM_SPEC_MISSING",
      "locator": "context:diagnostics[0]",
      "excerpt": "Preheater Feed is missing temperature specification."
    },
    {
      "id": "diag-2",
      "kind": "context",
      "label": "诊断 HEATER_OUTLET_EFFECT_UNCONFIRMED",
      "locator": "context:diagnostics[1]",
      "excerpt": "The current outlet response may still be influenced by upstream uncertainty, so the heater effect is not yet confirmed as a separate root cause."
    },
    {
      "id": "flowdoc-stream-1",
      "kind": "artifact",
      "label": "FlowsheetDocument / feed-6",
      "locator": "artifact:flowsheet_document.streams[0]",
      "excerpt": "feed-6 Preheater Feed target_unit_id=heater-2"
    },
    {
      "id": "flowdoc-unit-1",
      "kind": "artifact",
      "label": "FlowsheetDocument / heater-2",
      "locator": "artifact:flowsheet_document.units[0]",
      "excerpt": "heater-2 Preheater kind=Heater"
    },
    {
      "id": "snapshot-1",
      "kind": "context",
      "label": "求解快照 latest_snapshot",
      "locator": "context:latest_snapshot",
      "excerpt": "solver_status=partial_convergence residual_norm=0.11"
    }
  ],
  "risk_level": "medium"
}
