{
  "schema_version": 1,
  "project": "radishflow",
  "task": "suggest_flowsheet_edits",
  "status": "partial",
  "requires_confirmation": true,
  "answers": [
    {
      "kind": "direct_answer",
      "text": "当前围绕 Transfer Pump (pump-14)、Trim Heater (heater-14) 及其关联流股 feed-93、pump-outlet-93、heater-outlet-93 生成候选编辑提案。诊断显示三项错误：heater-outlet-93 未连接下游、feed-93 缺少流量规格、pump-14 出口压力目标低于进口压力；两项警告：pump-14 效率超出推荐范围、heater-14 出口状态在下游恢复前可能漂移。本次提案覆盖所有三项错误和 pump-14 的参数警告，heater-14 的警告属于信息性提示，暂不生成 patch。由于 heater-outlet-93 的下游连接目标在当前 flowsheet 中不存在，该条 patch 仅放置占位符，标记为 partial。",
      "citation_ids": [
        "diag-1",
        "flowdoc-stream-3",
        "flowdoc-unit-2",
        "flowdoc-stream-2",
        "flowdoc-unit-1",
        "snapshot-1",
        "diag-2",
        "flowdoc-stream-1",
        "diag-3",
        "diag-4"
      ]
    }
  ],
  "proposed_actions": [
    {
      "kind": "candidate_edit",
      "title": "为 heater-outlet-93 添加下游连接占位符",
      "rationale": "heater-outlet-93 当前 source_unit_id 为 heater-14，但缺少 target_unit_id，导致 STREAM_DISCONNECTED 错误和 solver invalid_topology。此 patch 插入一个 connection_placeholder，提示用户指定下游单元。由于当前 flowsheet 中不存在可确定的下游目标，仅放置占位符而非实际重连。",
      "risk_level": "high",
      "requires_confirmation": true,
      "citation_ids": [
        "diag-1",
        "flowdoc-stream-3",
        "flowdoc-unit-2",
        "flowdoc-stream-2",
        "flowdoc-unit-1",
        "snapshot-1"
      ],
      "target": {
        "type": "stream",
        "id": "heater-outlet-93"
      },
      "patch": {
        "connection_placeholder": {
          "expected_downstream_kind": "consumer_or_export_sink",
          "requires_manual_binding": true,
          "retain_existing_source_binding": true
        }
      }
    },
    {
      "kind": "candidate_edit",
      "title": "为 feed-93 补全流量规格占位符",
      "rationale": "feed-93 当前仅有 pressure_kpa 和 temperature_c，缺少 flow_rate 规格，触发 STREAM_SPEC_MISSING 错误。此 patch 在 specs 中插入 flow_rate 占位符，等待用户填入实际值。",
      "risk_level": "medium",
      "requires_confirmation": true,
      "citation_ids": [
        "diag-2",
        "flowdoc-stream-1",
        "flowdoc-unit-1"
      ],
      "target": {
        "type": "stream",
        "id": "feed-93"
      },
      "patch": {
        "spec_placeholders": [
          "stream_id",
          "add_specs",
          "hint"
        ],
        "retain_existing_specs": true
      }
    },
    {
      "kind": "candidate_edit",
      "title": "修正 pump-14 出口压力目标至高于进口压力",
      "rationale": "pump-14 当前 outlet_pressure_target_kpa=170，而进口流股 feed-93 的 pressure_kpa=210，出口目标低于进口，物理上不合理。建议将 outlet_pressure_target_kpa 上调至 350 kPa（进口压力的约 1.67 倍，属于常见离心泵升压比），用户可根据实际工艺需求调整。同时 pump-outlet-93 的 pressure_kpa 当前为 178，也应随之更新以保持一致性，但该值最终应由求解器重新计算，此处仅标记为待更新。",
      "risk_level": "medium",
      "requires_confirmation": true,
      "citation_ids": [
        "diag-3",
        "diag-4",
        "flowdoc-unit-1"
      ],
      "target": {
        "type": "unit",
        "id": "pump-14"
      },
      "patch": {
        "parameter_updates": {
          "outlet_pressure_target_kpa": {
            "action": "review_and_raise_above_inlet",
            "minimum_reference_stream_id": "feed-93"
          }
        },
        "preserve_topology": true
      }
    }
  ],
  "issues": [
    {
      "code": "STREAM_DISCONNECTED",
      "message": "Trim Heater Outlet 93 is not connected to any downstream consumer or export sink.",
      "severity": "error",
      "citation_ids": [
        "diag-1",
        "flowdoc-stream-3",
        "flowdoc-unit-2",
        "snapshot-1"
      ]
    },
    {
      "code": "STREAM_SPEC_MISSING",
      "message": "Transfer Pump Feed is missing flow rate specification.",
      "severity": "error",
      "citation_ids": [
        "diag-2",
        "flowdoc-stream-1",
        "flowdoc-unit-1"
      ]
    },
    {
      "code": "PUMP_OUTLET_PRESSURE_TARGET_INVALID",
      "message": "Transfer Pump outlet pressure target is lower than the inlet pressure.",
      "severity": "error",
      "citation_ids": [
        "diag-3",
        "flowdoc-unit-1"
      ]
    },
    {
      "code": "UNIT_PARAMETER_OUT_OF_RANGE",
      "message": "Transfer Pump efficiency_percent=54 is outside the recommended operating range.",
      "severity": "warning",
      "citation_ids": [
        "diag-4",
        "flowdoc-unit-1",
        "snapshot-1"
      ]
    },
    {
      "code": "HEATER_OUTLET_STATE_DEPENDENT",
      "message": "Trim Heater outlet condition may still shift after the downstream sink is restored, so the heater should remain explanatory context only.",
      "severity": "warning",
      "citation_ids": [
        "diag-5",
        "flowdoc-unit-2",
        "snapshot-1"
      ]
    }
  ],
  "citations": [
    {
      "id": "diag-1",
      "kind": "context",
      "label": "诊断 STREAM_DISCONNECTED",
      "locator": "context:diagnostics[0]",
      "excerpt": "Trim Heater Outlet 93 is not connected to any downstream consumer or export sink."
    },
    {
      "id": "diag-2",
      "kind": "context",
      "label": "诊断 STREAM_SPEC_MISSING",
      "locator": "context:diagnostics[1]",
      "excerpt": "Transfer Pump Feed is missing flow rate specification."
    },
    {
      "id": "diag-3",
      "kind": "context",
      "label": "诊断 PUMP_OUTLET_PRESSURE_TARGET_INVALID",
      "locator": "context:diagnostics[2]",
      "excerpt": "Transfer Pump outlet pressure target is lower than the inlet pressure."
    },
    {
      "id": "diag-4",
      "kind": "context",
      "label": "诊断 UNIT_PARAMETER_OUT_OF_RANGE",
      "locator": "context:diagnostics[3]",
      "excerpt": "Transfer Pump efficiency_percent=54 is outside the recommended operating range."
    },
    {
      "id": "diag-5",
      "kind": "context",
      "label": "诊断 HEATER_OUTLET_STATE_DEPENDENT",
      "locator": "context:diagnostics[4]",
      "excerpt": "Trim Heater outlet condition may still shift after the downstream sink is restored, so the heater should remain explanatory context only."
    },
    {
      "id": "flowdoc-stream-3",
      "kind": "artifact",
      "label": "FlowsheetDocument / heater-outlet-93",
      "locator": "artifact:flowsheet_document.streams[2]",
      "excerpt": "heater-outlet-93 Trim Heater Outlet 93 source_unit_id=heater-14"
    },
    {
      "id": "flowdoc-stream-1",
      "kind": "artifact",
      "label": "FlowsheetDocument / feed-93",
      "locator": "artifact:flowsheet_document.streams[0]",
      "excerpt": "feed-93 Transfer Pump Feed target_unit_id=pump-14"
    },
    {
      "id": "flowdoc-unit-1",
      "kind": "artifact",
      "label": "FlowsheetDocument / pump-14",
      "locator": "artifact:flowsheet_document.units[0]",
      "excerpt": "pump-14 Transfer Pump kind=Pump"
    },
    {
      "id": "flowdoc-unit-2",
      "kind": "artifact",
      "label": "FlowsheetDocument / heater-14",
      "locator": "artifact:flowsheet_document.units[1]",
      "excerpt": "heater-14 Trim Heater kind=Heater"
    },
    {
      "id": "flowdoc-stream-2",
      "kind": "artifact",
      "label": "FlowsheetDocument / pump-outlet-93",
      "locator": "artifact:flowsheet_document.streams[1]",
      "excerpt": "pump-outlet-93 Pump Outlet 93 source_unit_id=pump-14 target_unit_id=heater-14"
    },
    {
      "id": "snapshot-1",
      "kind": "context",
      "label": "求解快照 latest_snapshot",
      "locator": "context:latest_snapshot",
      "excerpt": "solver_status=invalid_topology"
    }
  ],
  "summary": "当前围绕 Transfer Pump (pump-14)、Trim Heater (heater-14) 及其关联流股 feed-93、pump-outlet-93、heater-outlet-93 生成候选编辑提案。诊断显示三项错误：heater-outlet-93 未连接下游、feed-93 缺少流量规格、pump-14 出口压力目标低于进口压力；两项警告：pump-14 效率超出推荐范围、heater-14 出口状态在下游恢复前可能漂移。本次提案覆盖所有三项错误和 pump-14 的参数警告，heater-14 的警告属于信息性提示，暂不生成 patch。由于 heater-outlet-93 的下游连接目标在当前 flowsheet 中不存在，该条 patch 仅放置占位符，标记为 partial。",
  "risk_level": "high",
  "confidence": 0.2
}
