{
  "schema_version": 1,
  "project": "radishflow",
  "task": "suggest_flowsheet_edits",
  "status": "ok",
  "requires_confirmation": true,
  "summary": "针对选定的单元 heater-1 和流 feed-1，基于诊断提出的两个规格缺失问题生成候选编辑提案，为该流添加流量占位符，为该单元添加出口温度目标占位符。",
  "issues": [
    {
      "code": "STREAM_SPEC_MISSING",
      "message": "Cold Feed is missing flow rate specification.",
      "severity": "error",
      "citation_ids": [
        "diag-1",
        "flowdoc-stream-1"
      ]
    },
    {
      "code": "UNIT_PARAMETER_INCOMPLETE",
      "message": "Feed Heater is configured for outlet temperature control but outlet temperature target is missing.",
      "severity": "error",
      "citation_ids": [
        "diag-2",
        "flowdoc-unit-1"
      ]
    }
  ],
  "answers": [
    {
      "kind": "text",
      "text": "已生成两个候选编辑：为 Cold Feed 添加流量规格占位符，为 Feed Heater 添加出口温度占位符。这些占位符不会改变现有模拟，但提醒用户完成输入。",
      "citation_ids": [
        "diag-1",
        "flowdoc-stream-1",
        "diag-2",
        "flowdoc-unit-1"
      ]
    }
  ],
  "proposed_actions": [
    {
      "kind": "candidate_edit",
      "target": {
        "type": "stream",
        "id": "feed-1"
      },
      "title": "为 feed-1 补充缺失规格占位",
      "rationale": "当前诊断已明确指出该流股规格不完整，因此更合适的是补局部规格占位，而不是给整图 patch。",
      "patch": {
        "spec_placeholders": [
          "flow_rate_kg_per_h"
        ],
        "retain_existing_specs": true
      },
      "risk_level": "medium",
      "requires_confirmation": true,
      "citation_ids": [
        "diag-1",
        "flowdoc-stream-1"
      ]
    },
    {
      "kind": "candidate_edit",
      "target": {
        "type": "unit",
        "id": "heater-1"
      },
      "title": "为 heater-1 补充局部参数占位",
      "rationale": "当前诊断集中在局部参数或配置完整性，因此更合适的是输出可审查的局部参数占位提案。",
      "patch": {
        "parameter_placeholders": [
          "outlet_temperature_c"
        ],
        "patch_scope": "unit_parameters",
        "preserve_existing_connections": true
      },
      "risk_level": "medium",
      "requires_confirmation": true,
      "citation_ids": [
        "diag-2",
        "flowdoc-unit-1"
      ]
    }
  ],
  "confidence": 0.9,
  "citations": [
    {
      "id": "diag-1",
      "kind": "context",
      "label": "诊断 STREAM_SPEC_MISSING",
      "locator": "context:diagnostics[0]",
      "excerpt": "Cold Feed is missing flow rate specification."
    },
    {
      "id": "diag-2",
      "kind": "context",
      "label": "诊断 UNIT_PARAMETER_INCOMPLETE",
      "locator": "context:diagnostics[1]",
      "excerpt": "Feed Heater is configured for outlet temperature control but outlet temperature target is missing."
    },
    {
      "id": "flowdoc-stream-1",
      "kind": "artifact",
      "label": "FlowsheetDocument / feed-1",
      "locator": "artifact:flowsheet_document.streams[0]",
      "excerpt": "feed-1 Cold Feed target_unit_id=heater-1"
    },
    {
      "id": "flowdoc-unit-1",
      "kind": "artifact",
      "label": "FlowsheetDocument / heater-1",
      "locator": "artifact:flowsheet_document.units[0]",
      "excerpt": "heater-1 Feed Heater kind=Heater"
    }
  ],
  "risk_level": "medium"
}
